{
  "schema_version": "curve.task-model-policy-matrix/v1",
  "contract_state": "PROPOSED_NOT_NORMATIVE",
  "matrix_id": "M0_S9C1A_TASK_MODEL_POLICY",
  "matrix_version": 1,
  "status": "DRAFT",
  "catalog_id": "M0_S9C1A_MODEL_CATALOG",
  "catalog_version": 1,
  "catalog_digest": "sha256:aa6dadabe1a0d6f14eb01d09b1ca9aad47667c0be7dc22dbe7dc3fe5e81e4d98",
  "policies": [],
  "policy_activation_allowed": false,
  "d004_decision_digest": null,
  "d005_decision_digest": null,
  "d014_budget_decision_digest": null
}
